O*NET-SOC 2010 Code,O*NET-SOC 2010 Title,O*NET-SOC 2010 Description
11-1021.00,General and Operations Managers,"Plan, direct, or coordinate the operations of public or private sector organizations. Duties and responsibilities include formulating policies, managing daily operations, and planning the use of materials and human resources, but are too diverse and general in nature to be classified in any one functional area of management or administration, such as personnel, purchasing, or administrative services."
11-2021.00,Marketing Managers,"Plan, direct, or coordinate marketing policies and programs, such as determining the demand for products and services offered by a firm and its competitors, and identify potential customers. Develop pricing strategies with the goal of maximizing the firm's profits or share of the market while ensuring the firm's customers are satisfied. Oversee product development or monitor trends that indicate the need for new products and services."
11-9039.02,Fitness and Wellness Coordinators,"Manage or coordinate fitness and wellness programs and services. Manage and train staff of wellness specialists, health educators, or fitness instructors."
13-1022.00,"Wholesale and Retail Buyers, Except Farm Products","Buy merchandise or commodities, other than farm products, for resale to consumers at the wholesale or retail level, including both durable and nondurable goods. Analyze past buying trends, sales records, price, and quality of merchandise to determine value and yield. Select, order, and authorize payment for merchandise according to contractual agreements. May conduct meetings with sales personnel and introduce new products. Includes assistant wholesale and retail buyers of nonfarm products."
13-1041.02,Licensing Examiners and Inspectors,"Examine, evaluate, and investigate eligibility for, conformity with, or liability under licenses or permits."
13-1041.03,Equal Opportunity Representatives and Officers,"Monitor and evaluate compliance with equal opportunity laws, guidelines, and policies to ensure that employment practices and contracting arrangements give equal opportunity without regard to race, religion, color, national origin, sex, age, or disability."
13-1075.00,Labor Relations Specialists,"Resolve disputes between workers and managers, negotiate collective bargaining agreements, or coordinate grievance procedures to handle employee complaints."
15-1199.06,Database Architects,"Design strategies for enterprise database systems and set standards for operations, programming, and security. Design and construct large relational databases. Integrate new systems with existing warehouse structure and refine system performance and functionality."
17-2011.00,Aerospace Engineers,"Perform engineering duties in designing, constructing, and testing aircraft, missiles, and spacecraft. May conduct basic and applied research to evaluate adaptability of materials and equipment to aircraft design and manufacture. May recommend improvements in testing equipment and techniques."
17-2071.00,Electrical Engineers,"Research, design, develop, test, or supervise the manufacturing and installation of electrical equipment, components, or systems for commercial, industrial, military, or scientific use."
17-2072.01,Radio Frequency Identification Device Specialists,Design and implement radio frequency identification device (RFID) systems used to track shipments or goods.
17-2121.02,Marine Architects,"Design and oversee construction and repair of marine craft and floating structures such as ships, barges, tugs, dredges, submarines, torpedoes, floats, and buoys. May confer with marine engineers."
17-2141.00,Mechanical Engineers,"Perform engineering duties in planning and designing tools, engines, machines, and other mechanically functioning equipment. Oversee installation, operation, maintenance, and repair of equipment such as centralized heat, gas, water, and steam systems."
17-2199.09,Nanosystems Engineers,"Design, develop, or supervise the production of materials, devices, or systems of unique molecular or macromolecular composition, applying principles of nanoscale physics and electrical, chemical, or biological engineering."
17-2199.11,Solar Energy Systems Engineers,"Perform site-specific engineering analysis or evaluation of energy efficiency and solar projects involving residential, commercial, or industrial customers. Design solar domestic hot water and space heating systems for new and existing structures, applying knowledge of structural energy requirements, local climates, solar technology, and thermodynamics."
17-3024.00,Electro-Mechanical Technicians,"Operate, test, maintain, or calibrate unmanned, automated, servo-mechanical, or electromechanical equipment. May operate unmanned submarines, aircraft, or other equipment at worksites, such as oil rigs, deep ocean exploration, or hazardous waste removal. May assist engineers in testing and designing robotics equipment."
19-1032.00,Foresters,"Manage public and private forested lands for economic, recreational, and conservation purposes. May inventory the type, amount, and location of standing timber, appraise the timber's worth, negotiate the purchase, and draw up contracts for procurement. May determine how to conserve wildlife habitats, creek beds, water quality, and soil stability, and how best to comply with environmental regulations. May devise plans for planting and growing new trees, monitor trees for healthy growth, and determine optimal harvesting schedules."
19-2041.03,Industrial Ecologists,Apply principles and processes of natural ecosystems to develop models for efficient industrial systems. Use knowledge from the physical and social sciences to maximize effective use of natural resources in the production and use of goods and services. Examine societal issues and their relationship with both technical systems and the environment.
19-3093.00,Historians,"Research, analyze, record, and interpret the past as recorded in sources, such as government and institutional records, newspapers and other periodicals, photographs, interviews, films, electronic media, and unpublished manuscripts, such as personal diaries and letters."
19-4041.02,Geological Sample Test Technicians,"Test or analyze geological samples, crude oil, or minerals to detect presence of petroleum, gas, or mineral deposits indicating potential for exploration or production or to determine physical or chemical properties to ensure that products meet quality standards."
21-2011.00,Clergy,Conduct religious worship and perform other spiritual functions associated with beliefs and practices of religious faith or denomination. Provide spiritual and moral guidance and assistance to members.
21-2021.00,"Directors, Religious Activities and Education","Plan, direct, or coordinate programs designed to promote the religious education or activities of a denominational group. May provide counseling and guidance relative to marital, health, financial, and religious problems."
25-2052.00,"Special Education Teachers, Kindergarten and Elementary School",Teach elementary school subjects to educationally and physically handicapped students. Includes teachers who specialize and work with audibly and visually handicapped students and those who teach basic academic and life processes skills to the mentally impaired.
25-9021.00,Farm and Home Management Advisors,"Advise, instruct, and assist individuals and families engaged in agriculture, agricultural-related processes, or home economics activities. Demonstrate procedures and apply research findings to solve problems; and instruct and train in product development, sales, and the use of machinery and equipment to promote general welfare. Includes county agricultural agents, feed and farm management advisors, home economists, and extension service advisors."
27-1023.00,Floral Designers,"Design, cut, and arrange live, dried, or artificial flowers and foliage."
27-1026.00,Merchandise Displayers and Window Trimmers,"Plan and erect commercial displays, such as those in windows and interiors of retail stores and at trade exhibitions."
29-2081.00,"Opticians, Dispensing","Design, measure, fit, and adapt lenses and frames for client according to written optical prescription or specification. Assist client with inserting, removing, and caring for contact lenses. Assist client with selecting frames. Measure customer for size of eyeglasses and coordinate frames with facial and eye measurements and optical prescription. Prepare work order for optical laboratory containing instructions for grinding and mounting lenses in frames. Verify exactness of finished lens spectacles. Adjust frame and lens position to fit client. May shape or reshape frames. Includes contact lens opticians."
29-2099.07,Surgical Assistants,"Assist surgeons during surgery by performing duties such as tissue retraction, insertion of tubes and intravenous lines, or closure of surgical wounds. Perform preoperative and postoperative duties to facilitate patient care."
31-9011.00,Massage Therapists,"Perform therapeutic massages of soft tissues and joints. May assist in the assessment of range of motion and muscle strength, or propose client therapy plans."
33-9021.00,Private Detectives and Investigators,"Gather, analyze, compile and report information regarding individuals or organizations to clients, or detect occurrences of unlawful acts or infractions of rules in private establishment."
35-3022.01,Baristas,Prepare or serve specialty coffee or other beverages. Serve food such as baked goods or sandwiches to patrons.
37-1012.00,"First-Line Supervisors of Landscaping, Lawn Service, and Groundskeeping Workers","Directly supervise and coordinate activities of workers engaged in landscaping or groundskeeping activities. Work may involve reviewing contracts to ascertain service, machine, and workforce requirements; answering inquiries from potential customers regarding methods, material, and price ranges; and preparing estimates according to labor, material, and machine costs."
37-2021.00,Pest Control Workers,Apply or release chemical solutions or toxic gases and set traps to kill or remove pests and vermin that infest buildings and surrounding areas.
37-3011.00,Landscaping and Groundskeeping Workers,"Landscape or maintain grounds of property using hand or power tools or equipment. Workers typically perform a variety of tasks, which may include any combination of the following: sod laying, mowing, trimming, planting, watering, fertilizing, digging, raking, sprinkler installation, and installation of mortarless segmental concrete masonry wall units."
37-3012.00,"Pesticide Handlers, Sprayers, and Applicators, Vegetation","Mix or apply pesticides, herbicides, fungicides, or insecticides through sprays, dusts, vapors, soil incorporation, or chemical application on trees, shrubs, lawns, or botanical crops. Usually requires specific training and State or Federal certification."
39-1021.00,First-Line Supervisors of Personal Service Workers,"Directly supervise and coordinate activities of personal service workers, such as flight attendants, hairdressers, or caddies."
39-3031.00,"Ushers, Lobby Attendants, and Ticket Takers","Assist patrons at entertainment events by performing duties, such as collecting admission tickets and passes from patrons, assisting in finding seats, searching for lost articles, and locating such facilities as rest rooms and telephones."
39-5092.00,Manicurists and Pedicurists,Clean and shape customers' fingernails and toenails. May polish or decorate nails.
41-2022.00,Parts Salespersons,Sell spare and replacement parts and equipment in repair shop or parts store.
41-3031.01,"Sales Agents, Securities and Commodities","Buy and sell securities in investment and trading firms and develop and implement financial plans for individuals, businesses, and organizations."
41-3031.03,Securities and Commodities Traders,"Buy and sell securities and commodities to transfer debt, capital, or risk. Establish and negotiate unit prices and terms of sale."
41-9021.00,Real Estate Brokers,"Operate real estate office, or work for commercial real estate firm, overseeing real estate transactions. Other duties usually include selling real estate or renting properties and arranging loans."
43-1011.00,First-Line Supervisors of Office and Administrative Support Workers,Directly supervise and coordinate the activities of clerical and administrative support workers.
43-3061.00,Procurement Clerks,Compile information and records to draw up purchase orders for procurement of materials and services.
43-5081.01,"Stock Clerks, Sales Floor","Receive, store, and issue sales floor merchandise. Stock shelves, racks, cases, bins, and tables with merchandise and arrange merchandise displays to attract customers. May periodically take physical count of stock or check and mark merchandise."
43-5081.03,"Stock Clerks- Stockroom, Warehouse, or Storage Yard","Receive, store, and issue materials, equipment, and other items from stockroom, warehouse, or storage yard. Keep records and compile stock reports."
43-5081.04,"Order Fillers, Wholesale and Retail Sales","Fill customers' mail and telephone orders from stored merchandise in accordance with specifications on sales slips or order forms. Duties include computing prices of items, completing order receipts, keeping records of out-going orders, and requisitioning additional materials, supplies, and equipment."
43-9041.01,Insurance Claims Clerks,Obtain information from insured or designated persons for purpose of settling claim with insurance carrier.
43-9111.00,Statistical Assistants,Compile and compute data according to statistical formulas for use in statistical studies. May perform actuarial computations and compile charts and graphs for use by actuaries. Includes actuarial clerks.
47-2011.00,Boilermakers,"Construct, assemble, maintain, and repair stationary steam boilers and boiler house auxiliaries. Align structures or plate sections to assemble boiler frame tanks or vats, following blueprints. Work involves use of hand and power tools, plumb bobs, levels, wedges, dogs, or turnbuckles. Assist in testing assembled vessels. Direct cleaning of boilers and boiler furnaces. Inspect and repair boiler fittings, such as safety valves, regulators, automatic-control mechanisms, water columns, and auxiliary machines."
47-2053.00,Terrazzo Workers and Finishers,"Apply a mixture of cement, sand, pigment, or marble chips to floors, stairways, and cabinet fixtures to fashion durable and decorative surfaces."
47-2082.00,Tapers,Seal joints between plasterboard or other wallboard to prepare wall surface for painting or papering.
47-2131.00,"Insulation Workers, Floor, Ceiling, and Wall","Line and cover structures with insulating materials. May work with batt, roll, or blown insulation materials."
47-2151.00,Pipelayers,"Lay pipe for storm or sanitation sewers, drains, and water mains. Perform any combination of the following tasks: grade trenches or culverts, position pipe, or seal joints."
47-2161.00,Plasterers and Stucco Masons,"Apply interior or exterior plaster, cement, stucco, or similar materials. May also set ornamental plaster."
47-2171.00,Reinforcing Iron and Rebar Workers,"Position and secure steel bars or mesh in concrete forms in order to reinforce concrete. Use a variety of fasteners, rod-bending machines, blowtorches, and hand tools. Includes rod busters."
47-2181.00,Roofers,"Cover roofs of structures with shingles, slate, asphalt, aluminum, wood, or related materials. May spray roofs, sidings, and walls with material to bind, seal, insulate, or soundproof sections of structures."
47-2221.00,Structural Iron and Steel Workers,"Raise, place, and unite iron or steel girders, columns, and other structural members to form completed structures or structural frameworks. May erect metal storage tanks and assemble prefabricated metal buildings."
47-4041.00,Hazardous Materials Removal Workers,"Identify, remove, pack, transport, or dispose of hazardous materials, including asbestos, lead-based paint, waste oil, fuel, transmission fluid, radioactive materials, or contaminated soil. Specialized training and certification in hazardous materials handling or a confined entry permit are generally required. May operate earth-moving equipment or trucks."
47-4061.00,Rail-Track Laying and Maintenance Equipment Operators,"Lay, repair, and maintain track for standard or narrow-gauge railroad equipment used in regular railroad service or in plant yards, quarries, sand and gravel pits, and mines. Includes ballast cleaning machine operators and railroad bed tamping machine operators."
47-4099.02,Solar Thermal Installers and Technicians,"Install or repair solar energy systems designed to collect, store, and circulate solar-heated water for residential, commercial or industrial use."
49-2011.00,"Computer, Automated Teller, and Office Machine Repairers","Repair, maintain, or install computers, word processing systems, automated teller machines, and electronic office machines, such as duplicating and fax machines."
49-2091.00,Avionics Technicians,"Install, inspect, test, adjust, or repair avionics equipment, such as radar, radio, navigation, and missile control systems in aircraft or space vehicles."
49-2098.00,Security and Fire Alarm Systems Installers,"Install, program, maintain, or repair security or fire alarm wiring and equipment. Ensure that work is in accordance with relevant codes."
49-3051.00,Motorboat Mechanics and Service Technicians,Repair and adjust electrical and mechanical equipment of inboard or inboard-outboard boat engines.
49-3092.00,Recreational Vehicle Service Technicians,"Diagnose, inspect, adjust, repair, or overhaul recreational vehicles including travel trailers. May specialize in maintaining gas, electrical, hydraulic, plumbing, or chassis/towing systems as well as repairing generators, appliances, and interior components. Includes workers who perform customized van conversions."
49-9011.00,Mechanical Door Repairers,"Install, service, or repair automatic door mechanisms and hydraulic doors. Includes garage door mechanics."
49-9043.00,"Maintenance Workers, Machinery","Lubricate machinery, change parts, or perform other routine machinery maintenance."
49-9052.00,Telecommunications Line Installers and Repairers,"Install and repair telecommunications cable, including fiber optics."
49-9061.00,Camera and Photographic Equipment Repairers,"Repair and adjust cameras and photographic equipment, including commercial video and motion picture camera equipment."
49-9092.00,Commercial Divers,"Work below surface of water, using scuba gear to inspect, repair, remove, or install equipment and structures. May use a variety of power and hand tools, such as drills, sledgehammers, torches, and welding equipment. May conduct tests or experiments, rig explosives, or photograph structures or marine life."
51-2011.00,"Aircraft Structure, Surfaces, Rigging, and Systems Assemblers","Assemble, fit, fasten, and install parts of airplanes, space vehicles, or missiles, such as tails, wings, fuselage, bulkheads, stabilizers, landing gear, rigging and control equipment, or heating and ventilating systems."
51-3011.00,Bakers,"Mix and bake ingredients to produce breads, rolls, cookies, cakes, pies, pastries, or other baked goods."
51-4021.00,"Extruding and Drawing Machine Setters, Operators, and Tenders, Metal and Plastic","Set up, operate, or tend machines to extrude or draw thermoplastic or metal materials into tubes, rods, hoses, wire, bars, or structural shapes."
51-4031.00,"Cutting, Punching, and Press Machine Setters, Operators, and Tenders, Metal and Plastic","Set up, operate, or tend machines to saw, cut, shear, slit, punch, crimp, notch, bend, or straighten metal or plastic material."
51-4121.07,Solderers and Brazers,"Braze or solder together components to assemble fabricated metal parts, using soldering iron, torch, or welding machine and flux."
51-4122.00,"Welding, Soldering, and Brazing Machine Setters, Operators, and Tenders","Set up, operate, or tend welding, soldering, or brazing machines or robots that weld, braze, solder, or heat treat metal products, components, or assemblies. Includes workers who operate laser cutters or laser-beam machines."
51-5113.00,Print Binding and Finishing Workers,Bind books and other publications or finish printed products by hand or machine. May set up binding and finishing machines.
51-6011.00,Laundry and Dry-Cleaning Workers,"Operate or tend washing or dry-cleaning machines to wash or dry-clean industrial or household articles, such as cloth garments, suede, leather, furs, blankets, draperies, linens, rugs, and carpets. Includes spotters and dyers of these articles."
51-7011.00,Cabinetmakers and Bench Carpenters,"Cut, shape, and assemble wooden articles or set up and operate a variety of woodworking machines, such as power saws, jointers, and mortisers to surface, cut, or shape lumber or to fabricate parts for wood products."
51-7042.00,"Woodworking Machine Setters, Operators, and Tenders, Except Sawing","Set up, operate, or tend woodworking machines, such as drill presses, lathes, shapers, routers, sanders, planers, and wood nailing machines. May operate CNC equipment."
51-8091.00,Chemical Plant and System Operators,Control or operate entire chemical processes or system of machines.
51-9011.00,Chemical Equipment Operators and Tenders,"Operate or tend equipment to control chemical changes or reactions in the processing of industrial or consumer products. Equipment used includes devulcanizers, steam-jacketed kettles, and reactor vessels."
51-9012.00,"Separating, Filtering, Clarifying, Precipitating, and Still Machine Setters, Operators, and Tenders","Set up, operate, or tend continuous flow or vat-type equipment; filter presses; shaker screens; centrifuges; condenser tubes; precipitating, fermenting, or evaporating tanks; scrubbing towers; or batch stills. These machines extract, sort, or separate liquids, gases, or solids from other materials to recover a refined product. Includes dairy processing equipment operators."
51-9051.00,"Furnace, Kiln, Oven, Drier, and Kettle Operators and Tenders","Operate or tend heating equipment other than basic metal, plastic, or food processing equipment. Includes activities, such as annealing glass, drying lumber, curing rubber, removing moisture from materials, or boiling soap."
51-9082.00,Medical Appliance Technicians,"Construct, fit, maintain, or repair medical supportive devices, such as braces, orthotics and prosthetic devices, joints, arch supports, and other surgical and medical appliances."
51-9083.00,Ophthalmic Laboratory Technicians,"Cut, grind, and polish eyeglasses, contact lenses, or other precision optical elements. Assemble and mount lenses into frames or process other optical elements. Includes precision lens polishers or grinders, centerer-edgers, and lens mounters."
51-9191.00,Adhesive Bonding Machine Operators and Tenders,"Operate or tend bonding machines that use adhesives to join items for further processing or to form a completed product. Processes include joining veneer sheets into plywood; gluing paper; or joining rubber and rubberized fabric parts, plastic, simulated leather, or other materials."
51-9195.03,"Stone Cutters and Carvers, Manufacturing",Cut or carve stone according to diagrams and patterns.
51-9195.04,"Glass Blowers, Molders, Benders, and Finishers",Shape molten glass according to patterns.
51-9195.07,Molding and Casting Workers,"Perform a variety of duties such as mixing materials, assembling mold parts, filling molds, and stacking molds to mold and cast a wide range of products."
51-9198.00,Helpers--Production Workers,"Help production workers by performing duties requiring less skill. Duties include supplying or holding materials or tools, and cleaning work area and equipment."
53-1021.00,"First-Line Supervisors of Helpers, Laborers, and Material Movers, Hand","Directly supervise and coordinate the activities of helpers, laborers, or material movers."
53-2012.00,Commercial Pilots,"Pilot and navigate the flight of fixed-winged aircraft on nonscheduled air carrier routes, or helicopters. Requires Commercial Pilot certificate. Includes charter pilots with similar certification, and air ambulance and air tour pilots."
53-4011.00,Locomotive Engineers,"Drive electric, diesel-electric, steam, or gas-turbine-electric locomotives to transport passengers or freight. Interpret train orders, electronic or manual signals, and railroad rules and regulations."
53-5021.01,Ship and Boat Captains,"Command vessels in oceans, bays, lakes, rivers, or coastal waters."
53-5021.02,"Mates- Ship, Boat, and Barge","Supervise or coordinate activities of crew aboard ships, boats, barges, or dredges."
53-5021.03,"Pilots, Ship","Command ships to steer them into and out of harbors, estuaries, straits, or sounds, or on rivers, lakes, or bays. Must be licensed by U.S. Coast Guard with limitations indicating class and tonnage of vessels for which license is valid and route and waters that may be piloted."
53-6021.00,Parking Lot Attendants,Park vehicles or issue tickets for customers in a parking lot or garage. May collect fee.
53-6051.07,"Transportation Vehicle, Equipment and Systems Inspectors, Except Aviation","Inspect and monitor transportation equipment, vehicles, or systems to ensure compliance with regulations and safety standards."
53-6061.00,"Transportation Attendants, Except Flight Attendants","Provide services to ensure the safety and comfort of passengers aboard ships, buses, trains, or within the station or terminal. Perform duties such as greeting passengers, explaining the use of safety equipment, serving meals or beverages, or answering questions related to travel."
