1/10/24 2:13:51,Factori Technologies LLC,,https://www.factori.ai,privacy@factori.ai,,8th Green STE A,Dover,DE,19901,USA,,No,Yes,No,https://www.factori.ai/privacy-policy,No,,No,,No,,No,,No,,N/A,,,,,,,,,,,,,,,,,,,,,,,,,,,,,,,,,,,,,,,,,,,,,,,,,,,,,,,,,,,,,,,,,,,,,,,,,,,,,,,,,,,,,,,,,,,,,,,,,,,,,,,,,,,,,,,,,
1/10/24 3:26:18,"Cision US, Inc",Yes,https://www.cision.com,DPO@cision.com,,300 S Riverside Plz ,Chicago,IL ,60606,USA,,No,No,No,https://privacyportal-uk.onetrust.com/webform/d2cb5e2f-e4f8-4ada-be9f-38f2e699fd45/3216c7cb-cf10-465b-84f8-867628ba5273,No,,No,,No,,No,,No,,"Cision collects the Personally Identifiable Information (which may include name, email address, social handle or telephone number or other contact information) of journalists, influencers and authors who have made their information publicly available themselves. ",,,,,,,,,,,,,,,,,,,,,,,,,,,,,,,,,,,,,,,,,,,,,,,,,,,,,,,,,,,,,,,,,,,,,,,,,,,,,,,,,,,,,,,,,,,,,,,,,,,,,,,,,,,,,,,,,
1/10/24 6:04:52,Martin Data LLC,USinfoSearch.com,https://www.usinfosearch.com,Accounting@usinfosearch.com,614-626-2023,735 Taylor Road Ste 220,Columbus,OH,43230,USA,,No,No,No,https://www.martindataoptout.com/,No,,Yes,We are mandated by the GLBA laws.,No,,No,,No,,N/A,,,,,,,,,,,,,,,,,,,,,,,,,,,,,,,,,,,,,,,,,,,,,,,,,,,,,,,,,,,,,,,,,,,,,,,,,,,,,,,,,,,,,,,,,,,,,,,,,,,,,,,,,,,,,,,,,
1/10/24 6:20:38,Crimson Hexagon ,Yes - trading under the name Brandwatch ,https://www.brandwatch.com,DPO@cision.com,,300 S Riverside Plaza,Chicago,IL,60606,USA,,No,No,No,https://www.brandwatch.com/p/legal-data-subject-access-request/,No,,No,,No,,No,,No,,"Crimson Hexagon (trading as Brandwatch) collects the Personally Identifiable Information (which may include name, email address, social handle or telephone number or other contact information) of journalists, influencers and authors who have made their information publicly available themselves.",,,,,,,,,,,,,,,,,,,,,,,,,,,,,,,,,,,,,,,,,,,,,,,,,,,,,,,,,,,,,,,,,,,,,,,,,,,,,,,,,,,,,,,,,,,,,,,,,,,,,,,,,,,,,,,,,
1/10/24 7:57:50,"Cint USA, Inc.",,https://www.cint.com,compliance@cint.com,,1235 Saint Thomas Street Suite 201,New Orleans,LA,70130,USA,,No,No,No,https://samplicio.us/s/data-access-portal,No,,No,,No,,No,,No,,N/A,,,,,,,,,,,,,,,,,,,,,,,,,,,,,,,,,,,,,,,,,,,,,,,,,,,,,,,,,,,,,,,,,,,,,,,,,,,,,,,,,,,,,,,,,,,,,,,,,,,,,,,,,,,,,,,,,
1/10/24 8:14:48,"PlaceIQ, Inc.",,https://www.precisely.com,Privacy.PlaceIQ@Precisely.com,,1700 District Ave #300,Burlington,MA,01803,USA,,No,Yes,No,https://www.precisely.com/legal/privacy-policy/your-privacy-choices,No,,No,,No,,No,,No,,PlaceIQ respects your privacy and is committed to safeguarding your personal data that we collect and otherwise process about you. Please visit: www.precisely.com/legal/placeiq-product-privacy-notice to read our Privacy Notice and learn more about our privacy practices.,,,,,,,,,,,,,,,,,,,,,,,,,,,,,,,,,,,,,,,,,,,,,,,,,,,,,,,,,,,,,,,,,,,,,,,,,,,,,,,,,,,,,,,,,,,,,,,,,,,,,,,,,,,,,,,,,
1/10/24 9:04:00,"Sabio, Inc",,https://www.sabio.inc,privacy@sabio.inc,,"16350 Ventura Blvd, D827",Encino,CA,91436,USA,,No,Yes,No,https://www.sabio.inc/privacypolicy,No,,No,,No,,No,,No,,None,,,,,,,,,,,,,,,,,,,,,,,,,,,,,,,,,,,,,,,,,,,,,,,,,,,,,,,,,,,,,,,,,,,,,,,,,,,,,,,,,,,,,,,,,,,,,,,,,,,,,,,,,,,,,,,,,
1/10/24 9:18:42,LoopMe Ltd ,LoopMe Inc,https://www.loopme.com,legal@loopme.com,,"853 Broadway, 6th Floor (Suite 600)",New York,NY,10003,USA,"LoopMe Ltd, Ground Floor, 32-38 Saffron Hill, London, England, EC1N 8FH, United Kingdom ",No,Yes,No,https://legal.loopme.com/privacy-center,No,,No,,No,,No,,No,,"Details of our data collection are available in our privacy policy here: legal.loopme.com/privacy-center 
LoopMe collects precise location data only on the basis of consent.",,,,,,,,,,,,,,,,,,,,,,,,,,,,,,,,,,,,,,,,,,,,,,,,,,,,,,,,,,,,,,,,,,,,,,,,,,,,,,,,,,,,,,,,,,,,,,,,,,,,,,,,,,,,,,,,,
1/10/24 9:33:03,"AppScience, Inc.",,https://www.appscience.inc,privacy@appscience.inc,,"16350 Ventura Blvd, Suite D827",Encino,CA,91436,USA,,No,Yes,No,https://www.appscience.inc/privacy-policy,No,,No,,No,,No,,No,,None,,,,,,,,,,,,,,,,,,,,,,,,,,,,,,,,,,,,,,,,,,,,,,,,,,,,,,,,,,,,,,,,,,,,,,,,,,,,,,,,,,,,,,,,,,,,,,,,,,,,,,,,,,,,,,,,,
1/10/24 9:44:44,"LiveRamp Holdings, LLC",,https://www.liveramp.com,"consumercare@liveramp.com
janey.newell@liveramp.com",,225 Bush St 17th Floor,San Francisco,CA,94104,USA,,No,No,No,https://liveramp.com/privacy/,No,,No,,No,,No,,Yes,"LiveRamp does not collect PHI. However, LiveRamp, in its capacity as a business associate, will processes PHI on behalf of covered entities under HIPAA pursuant to a Business Associate Agreement",N/A,,,,,,,,,,,,,,,,,,,,,,,,,,,,,,,,,,,,,,,,,,,,,,,,,,,,,,,,,,,,,,,,,,,,,,,,,,,,,,,,,,,,,,,,,,,,,,,,,,,,,,,,,,,,,,,,,
1/10/24 10:01:58,J.D. Power,,https://www.jdpower.com,legal@jdpa.com,,"320 East Big Beaver Road, Suite 500",Troy,MI,48083,USA,,No,Yes,No,https://www.jdpower.com/privacy/california,No,,Yes,GLBA applies to the business as it acts as a service provider to financial institutions.,No,,No,,Yes,HIPAA applies to the business as it acts as a service provider.,Our collection practices are as outlined in our privacy policies. ,,,,,,,,,,,,,,,,,,,,,,,,,,,,,,,,,,,,,,,,,,,,,,,,,,,,,,,,,,,,,,,,,,,,,,,,,,,,,,,,,,,,,,,,,,,,,,,,,,,,,,,,,,,,,,,,,
1/10/24 12:18:58,"Quad/Graphics, Inc",Quad,https://www.quad.com,ComplianceDept@quad.com,,N61 W23044 Harry's Way,Sussex,WI,53089,USA,,No,No,No,https://www.quad.com/legal/privacy-policy,No,,No,,No,,Yes,"QuadMed is a subsidiary of Quad/Graphics, Inc. that controls, maintains, or manages the flow of medical information.
",Yes,"QuadMed is a subsidiary of Quad/Graphics, Inc. that controls, maintains, or manages the flow of medical information.",Not at this time.,,,,,,,,,,,,,,,,,,,,,,,,,,,,,,,,,,,,,,,,,,,,,,,,,,,,,,,,,,,,,,,,,,,,,,,,,,,,,,,,,,,,,,,,,,,,,,,,,,,,,,,,,,,,,,,,,
1/10/24 12:26:11,"Oracle America, Inc. ",Oracle Advertising,https://www.oracle.com, oracle-datacloud-privacy_us@oracle.com,(800) 392-2999,2300 Oracle Way ,Austin,TX,78741,USA,,No,No,No,https://www.oracle.com/legal/privacy/advertising-privacy-policy.html,No,,No,,No,,No,,No,,Please refer to our privacy policy: www.oracle.com/legal/privacy/advertising-privacy-policy.html. We also offer an opt out that a data subject can access here: datacloudoptout.oracle.com/#optout. ,,,,,,,,,,,,,,,,,,,,,,,,,,,,,,,,,,,,,,,,,,,,,,,,,,,,,,,,,,,,,,,,,,,,,,,,,,,,,,,,,,,,,,,,,,,,,,,,,,,,,,,,,,,,,,,,,
1/10/24 12:52:55,Precisely Software Incorporated,,https://www.precisely.com,privacy@precisely.com,,1700 District Ave #300,Burlington,MA,01803,USA,,No,No,No,https://www.precisely.com/legal/privacy-notice,No,,No,,No,,No,,Yes,The business is required to comply with the HIPAA Rule in its capacity as a business associate.,Precisely respects your privacy and is committed to safeguarding your personal data that we collect and otherwise process about you. Please visit: www.precisely.com/legal/privacy-notice to read our Privacy Notice and learn more about our privacy practices.,,,,,,,,,,,,,,,,,,,,,,,,,,,,,,,,,,,,,,,,,,,,,,,,,,,,,,,,,,,,,,,,,,,,,,,,,,,,,,,,,,,,,,,,,,,,,,,,,,,,,,,,,,,,,,,,,
1/10/24 15:39:07,"Harmon Research Group, LLC",,https://www.harmonresearch.com,joey.harmon@harmonresearch.com,714.280.0333,"751 S Weir Canyon Road, Suite 157622",Anaheim,CA,92808,USA,,Yes,Yes,No,https://www.harmonresearch.com/privacy-policy,No,,No,,No,,No,,No,,Harmon Research always asks respondents permission before collecting any data.  We are a survey research company and do not sell individuals personal information.  Only aggregated data for research purposes.  ,,,,,,,,,,,,,,,,,,,,,,,,,,,,,,,,,,,,,,,,,,,,,,,,,,,,,,,,,,,,,,,,,,,,,,,,,,,,,,,,,,,,,,,,,,,,,,,,,,,,,,,,,,,,,,,,,
1/10/24 18:01:26,JDM LIST SERVICES,,https://www.jdmlistservices.com,chrissy@jdmlistservices.com,347-213-0076,1400 5th Ave# 2G,New York,NY,10026,ESSEX,,No,No,No,https://jdmlistservices.com/privacy-policy,No,,No,,No,,No,,No,,"JDM does not personally collect data, but does partner with companies, who does. ",,,,,,,,,,,,,,,,,,,,,,,,,,,,,,,,,,,,,,,,,,,,,,,,,,,,,,,,,,,,,,,,,,,,,,,,,,,,,,,,,,,,,,,,,,,,,,,,,,,,,,,,,,,,,,,,,
1/11/24 2:24:07,FlashIntel,,https://www.flashintel.ai,legal@myflashcloud.com,,Two Embarcadero Center,San Francisco,CA,94111,USA,,No,No,No,https://www.flashintel.ai/privacy-statement-us/,No,,No,,No,,No,,No,,yes,,,,,,,,,,,,,,,,,,,,,,,,,,,,,,,,,,,,,,,,,,,,,,,,,,,,,,,,,,,,,,,,,,,,,,,,,,,,,,,,,,,,,,,,,,,,,,,,,,,,,,,,,,,,,,,,,
1/11/24 7:30:48,"BeenVerified, LLC, The Lifetime Value Co. LLC, its subsidiaries and affiliates",BeenVerified.com,https://www.beenverified.com,legal@ltvco.com,347-931-2725,"48 West 38th Street, 8th Floor",New York,NY,10018,USA,,No,No,No,https://www.beenverified.com/app/optout/form,No,,No,,No,,No,,No,,See also www.beenverified.com/faq/privacy/ ,,,,,,,,,,,,,,,,,,,,,,,,,,,,,,,,,,,,,,,,,,,,,,,,,,,,,,,,,,,,,,,,,,,,,,,,,,,,,,,,,,,,,,,,,,,,,,,,,,,,,,,,,,,,,,,,,
1/11/24 7:53:26,"DEMANDBASE, INC.",,https://www.demandbase.com,privacy@demandbase.com,,"222 2nd Street, 24th Floor",San Francisco,CA,94105,USA,,No,No,No,www.demandbase.com/privacy,No,,No,,No,,No,,No,, ,,,,,,,,,,,,,,,,,,,,,,,,,,,,,,,,,,,,,,,,,,,,,,,,,,,,,,,,,,,,,,,,,,,,,,,,,,,,,,,,,,,,,,,,,,,,,,,,,,,,,,,,,,,,,,,,,
1/11/24 7:58:56,Aristotle International Inc.,,https://www.aristotle.com,Info@aristotle.com,202-543-8345,205 Pennsylvania Avenue SE,Washington,DC,20003,USA,,No,No,No,https://www.aristotle.com/privacy/addendum-for-california-residents/,No,,No,,No,,No,,No,,Additional information about Aristotle's data collection practices may be obtained at www.aristotle.com/privacy/,,,,,,,,,,,,,,,,,,,,,,,,,,,,,,,,,,,,,,,,,,,,,,,,,,,,,,,,,,,,,,,,,,,,,,,,,,,,,,,,,,,,,,,,,,,,,,,,,,,,,,,,,,,,,,,,,
1/11/24 8:42:18,Hivestack Inc.,,https://www.hivestack.com,privacy@hivestack.com,,118 Rue Saint-Pierre,Montreal,QC,H2Y 2L7,Canada,,No,Yes,No,https://www.hivestack.com/opt-out-california-residents/,No,,No,,No,,No,,No,,No further information to provide,,,,,,,,,,,,,,,,,,,,,,,,,,,,,,,,,,,,,,,,,,,,,,,,,,,,,,,,,,,,,,,,,,,,,,,,,,,,,,,,,,,,,,,,,,,,,,,,,,,,,,,,,,,,,,,,,
1/11/24 12:03:02,DatabaseUSA,DatabaseUSA,https://www.databaseusa.com,Privacy@databaseusa.com,,11211 John Galt Blvd,Omaha,NE,68137,USA,,No,No,No,https://privacycompliance.biz/databaseusa-ccpa/,No,,No,,No,,No,,No,,"Our Consumer Database is compiled from public and self-reported data sources to be used for Business to Consumer marketing purposes. DatabaseUSA does NOT compile or possess any of the following sensitive personal information: Driver’s License Information, Passport/Visa Numbers, State ID Information, Student Information, Social Security Numbers, Sexual Orientation Preferences, Credit/Debit Card Numbers, Private Medical/Health Records, Bank Account Numbers, Salary/Payroll/Benefit Data, PIN Numbers, Frequent Flyer Numbers, Exact FICO Scores/Credit Rating, Medical Insurance Information, Personal Account Numbers, Logon ID’s and Passwords, Biometric Data (Fingerprints, Facial Recognition, DNA, Retina Patterns, Blood Types or Signatures).",,,,,,,,,,,,,,,,,,,,,,,,,,,,,,,,,,,,,,,,,,,,,,,,,,,,,,,,,,,,,,,,,,,,,,,,,,,,,,,,,,,,,,,,,,,,,,,,,,,,,,,,,,,,,,,,,
1/11/24 12:59:55,ResearchUSA,ResearchUSA,https://www.researchusallc.com,privacy@researchusallc.com,,11133 O Street,Omaha,NE,68137,USA,,No,No,No,https://privacycompliance.biz/researchusallc-ccpa/,No,,No,,No,,No,,No,,"Our Consumer Database is compiled from public and self-reported data sources to be used for Business to Consumer marketing purposes. ResearchUSA does NOT compile or possess any of the following sensitive personal information: Driver’s License Information, Passport/Visa Numbers, State ID Information, Student Information, Social Security Numbers, Sexual Orientation Preferences, Credit/Debit Card Numbers, Private Medical/Health Records, Bank Account Numbers, Salary/Payroll/Benefit Data, PIN Numbers, Frequent Flyer Numbers, Exact FICO Scores/Credit Rating, Medical Insurance Information, Personal Account Numbers, Logon ID’s and Passwords, Biometric Data (Fingerprints, Facial Recognition, DNA, Retina Patterns, Blood Types or Signatures).",,,,,,,,,,,,,,,,,,,,,,,,,,,,,,,,,,,,,,,,,,,,,,,,,,,,,,,,,,,,,,,,,,,,,,,,,,,,,,,,,,,,,,,,,,,,,,,,,,,,,,,,,,,,,,,,,
1/11/24 13:32:40,"Guidestar Direct, Corp.",Carney Direct Marketing ,https://www.carneydirect.com,privacy@carneydirect.com,949-581-5100,"10 Hughes Suite A201
",Irvine,CA,92618,USA,,No,No,No,https://www.carneydirect.com/privacy-policy/,No,,No,,No,,No,,No,,N/A,,,,,,,,,,,,,,,,,,,,,,,,,,,,,,,,,,,,,,,,,,,,,,,,,,,,,,,,,,,,,,,,,,,,,,,,,,,,,,,,,,,,,,,,,,,,,,,,,,,,,,,,,,,,,,,,,
1/11/24 13:58:47,Infofree.com,Infofree.com,https://www.infofree.com,privacy@infofree.com,,11211 John Galt Blvd,Omaha,NE,68137,USA,,No,No,No,https://privacycompliance.biz/infofree-ccpa-cpra/,No,,No,,No,,No,,No,,"Our Consumer Database is compiled from public and self-reported data sources to be used for Business to Consumer marketing purposes. Infofree.com does NOT compile any of the following sensitive personal information: Driver’s License Information, Passport/Visa Numbers, State ID Information, Student Information, Social Security Numbers, Sexual Orientation Preferences, Credit/Debit Card Numbers, Private Medical/Health Records, Bank Account Numbers, Salary/Payroll/Benefit Data, PIN Numbers, Frequent Flyer Numbers, Exact FICO Scores/Credit Rating, Medical Insurance Information, Personal Account Numbers, Logon ID’s and Passwords, Biometric Data (Fingerprints, Facial Recognition, DNA, Retina Patterns, Blood Types or Signatures).",,,,,,,,,,,,,,,,,,,,,,,,,,,,,,,,,,,,,,,,,,,,,,,,,,,,,,,,,,,,,,,,,,,,,,,,,,,,,,,,,,,,,,,,,,,,,,,,,,,,,,,,,,,,,,,,,
1/11/24 14:36:09,"Civis Analytics, Inc.",,https://www.civisanalytics.com,dataprotection@civisanalytics.com,,"200 W Monroe Street, Suite 2200 ",Chicago,IL,60606,USA,,No,Yes,No,https://www.civisanalytics.com/privacy-policy/supplemental-privacy-notice/,No,,No,,No,,No,,No,,"A California consumer or their authorized representative may submit a request to Civis to exercise their rights regarding their personal information by completing the Civis Data Subject Request Form or by calling 877-788-5865. Where contacting us by phone, please provide the following information for the consumer: full name, mailing address, email address, telephone number, and type of rights request(s) being made. If this information is not provided, we may request additional information or confirmation, except where such verification is not permitted.

If a consumer has elected to use an authorized representative, the authorized representative must submit proof of their agency relationship in the form of a valid power of attorney in compliance with their agent’s state law or reliable evidence of signed permission to act on the consumer’s behalf. For the security of personal information, we will verify the consumer’s identity directly with them prior to processing a request submitted by an authorized representative and we will only share the consumer’s personal information with the consumer directly.
",,,,,,,,,,,,,,,,,,,,,,,,,,,,,,,,,,,,,,,,,,,,,,,,,,,,,,,,,,,,,,,,,,,,,,,,,,,,,,,,,,,,,,,,,,,,,,,,,,,,,,,,,,,,,,,,,
1/12/24 5:52:02,"Hunter Web Services, Inc.",,https://www.hunter.io,matt@hunter.io,,2810 N Church St #50754,Wilmington,DW,19802-4447,USA,,No,No,No,https://hunter.io/privacy-policy,No,,No,,No,,No,,No,,"Hunter collects publicly available professional contact information from the internet and collates the information for the benefit of its users. Hunter does not rely on third-party data.

This means that all the data we share is already publicly available, and in addition, we share the sources in which we have found the email addresses available on the web. We provide information in our privacy policy to disable Hunter's robot if anyone does not wish for their website to be crawled. Additionally, if someone does not wish to be listed in Hunter they can inform us using our claim feature, and their data is immediately deleted.",,,,,,,,,,,,,,,,,,,,,,,,,,,,,,,,,,,,,,,,,,,,,,,,,,,,,,,,,,,,,,,,,,,,,,,,,,,,,,,,,,,,,,,,,,,,,,,,,,,,,,,,,,,,,,,,,
1/12/24 9:48:36,"Outlogic, LLC",,https://www.outlogic.io,privacy@outlogic.io ,,"6525 The Corners Parkway NW, Suite 520",Peachtree Corners,GA,30092,USA,,No,Yes,No,https://outlogic.io/privacy-policy/,No,,No,,No,,No,,No,,N/A,,,,,,,,,,,,,,,,,,,,,,,,,,,,,,,,,,,,,,,,,,,,,,,,,,,,,,,,,,,,,,,,,,,,,,,,,,,,,,,,,,,,,,,,,,,,,,,,,,,,,,,,,,,,,,,,,
1/12/24 11:05:17,Deloitte Consulting LLP,,https://www.deloitte.com,usprivacyquestions@deloitte.com,,200 Berkeley Street,Boston,MA,02116,USA,,No,No,No,https://www2.deloitte.com/us/en/footerlinks1/predictrisk-privacy-notice.html,No,,No,,No,,No,,Yes,Deloitte Consulting LLP may perform services as a Business Associate of a Covered Entity,None,,,,,,,,,,,,,,,,,,,,,,,,,,,,,,,,,,,,,,,,,,,,,,,,,,,,,,,,,,,,,,,,,,,,,,,,,,,,,,,,,,,,,,,,,,,,,,,,,,,,,,,,,,,,,,,,,
1/12/24 11:18:00,Adstra LLC,,https://www.adstradata.com,privacy.officer@adstradata.com,609-580-2800,"750 College Road East, Suite 201",Princeton,NJ,08540,USA,,No,No,No,https://adstradata.com/privacy-policy/,No,,No,,No,,No,,No,,No,,,,,,,,,,,,,,,,,,,,,,,,,,,,,,,,,,,,,,,,,,,,,,,,,,,,,,,,,,,,,,,,,,,,,,,,,,,,,,,,,,,,,,,,,,,,,,,,,,,,,,,,,,,,,,,,,
1/12/24 11:24:08,Belardi Wong,,https://www.belardiwong.com,privacy.officer@belardiwong.com,212-924-1300,"750 College Road East, Suite 201",Princeton,NJ,08540,USA,,No,No,No,https://belardiwong.com/privacy-policy/,No,,No,,No,,No,,No,,No.,,,,,,,,,,,,,,,,,,,,,,,,,,,,,,,,,,,,,,,,,,,,,,,,,,,,,,,,,,,,,,,,,,,,,,,,,,,,,,,,,,,,,,,,,,,,,,,,,,,,,,,,,,,,,,,,,
1/13/24 4:06:04,Salutary Data LLC.,,https://www.salutarydata.com,info@salutarydata.com,,29 Locust Avenue,Lexington,MA,02421,USA,,No,No,No,https://salutarydata.com/privacy-opt-out-and-disclosure-form/,No,,No,,No,,No,,No,,"Salutary Data is an aggregator of information largely pertaining to people's business persona; their business card like profile and other publicly available info.  We do not collect such personal or consumer information such as a person's residential address, their date of birth, or social security number.",,,,,,,,,,,,,,,,,,,,,,,,,,,,,,,,,,,,,,,,,,,,,,,,,,,,,,,,,,,,,,,,,,,,,,,,,,,,,,,,,,,,,,,,,,,,,,,,,,,,,,,,,,,,,,,,,
1/15/24 3:59:43,Emailmovers Ltd,Emailmovers,https://www.emailmovers.com,compliance+ccpa@emailmovers.com,+44(0)1723 800030,"Suite 4, William Street Business Center 7A Lower Clark Street",Scarborough,UK,YO12 7PP,United Kingdom,,No,No,No,https://emailmovers.com/privacy-policy-emailmovers/,No,,No,,No,,No,,No,,"Emailmovers Ltd provides Non-HR business data that we get from a number of sources; a) Our research team sources information from publicly available information, b) Users provide data about themselves or other companies & people, c) We license data from other data providers. Our data is not considered sensitive or protected by HIPPA / FCRA.",,,,,,,,,,,,,,,,,,,,,,,,,,,,,,,,,,,,,,,,,,,,,,,,,,,,,,,,,,,,,,,,,,,,,,,,,,,,,,,,,,,,,,,,,,,,,,,,,,,,,,,,,,,,,,,,,
1/15/24 12:32:22,Diablo Media,,https://www.diablomedia.com,data@diablomedia.com,,3001 Brighton Blvd #769,Denver,CO,80216,USA,,No,No,No,https://www.everydayresources.com/privacy/ccpa,No,,No,,No,,No,,No,,None,,,,,,,,,,,,,,,,,,,,,,,,,,,,,,,,,,,,,,,,,,,,,,,,,,,,,,,,,,,,,,,,,,,,,,,,,,,,,,,,,,,,,,,,,,,,,,,,,,,,,,,,,,,,,,,,,
1/15/24 14:54:03,"Slashdot Media, LLC",Slashdot Media,https://www.slashdotmedia.com,roger.abbott@slashdotmedia.com,858-583-1700,225 Broadway Suite 1600,San Diego,CA,92112,USA,,No,No,No,privacy@slashdotmedia.com,No,,No,,No,,No,,No,,we only deal in B2B data,,,,,,,,,,,,,,,,,,,,,,,,,,,,,,,,,,,,,,,,,,,,,,,,,,,,,,,,,,,,,,,,,,,,,,,,,,,,,,,,,,,,,,,,,,,,,,,,,,,,,,,,,,,,,,,,,
1/16/24 1:12:07,Leadspace Inc,Leadspace,https://www.leadspace.com,compliance_privacy@leadspace.com ,+1855-532-3772,122 Grand Street ,New York,NY,10013,USA,,No,No,No,https://www.leadspace.com/do-not-sell-form/,No,,No,,No,,No,,No,,"Leadspace helps companies take back control of their marketing and sales data with its leading intelligent B2B Customer Data Platform. It provides with advanced tools for enriching and updating customers’ data with rich and open B2B data graph in the industry. Next, it leverages AI to unlock the insights and opportunities in customers’ data. Then, it helps activating the enhanced data, in real-time, across sales and marketing systems. Leadspace’s services enable effective and high-performing inbound, outbound, and ABM efforts that drive revenue. 

Leadspace does not process sensitive personal data. Leadspace's services do not include any processing of data related to consumer behavior, data covered by specific US legislation such as social security numbers, health related data, education related data, personal information related to children, credit reports, other financial data and government issued IDs. Furthermore, Leadspace's services do not process any ""special categories of data"", as this term is defined by Regulation (EU) 2016/679 (""GDPR""). ",,,,,,,,,,,,,,,,,,,,,,,,,,,,,,,,,,,,,,,,,,,,,,,,,,,,,,,,,,,,,,,,,,,,,,,,,,,,,,,,,,,,,,,,,,,,,,,,,,,,,,,,,,,,,,,,,
1/16/24 7:45:59,"MadHive, Inc.",,https://www.madhive.com,privacy@madhive.com,,"225 Broadway, 11th Fl",New York,NY,10007,USA,,No,No,No,https://madhive.com,No,,No,,No,,No,,No,,No additional information to provide.,,,,,,,,,,,,,,,,,,,,,,,,,,,,,,,,,,,,,,,,,,,,,,,,,,,,,,,,,,,,,,,,,,,,,,,,,,,,,,,,,,,,,,,,,,,,,,,,,,,,,,,,,,,,,,,,,
1/16/24 8:44:43,"All Global Resources, LLC",,https://www.agrgroupinc.com,lzepeda@agrgroupinc.com,,"2925 N. Green Valley Parkway, Suite C",Henderson,NV,89014,USA,,No,No,No,https://www.agrgroupinc.com,No,,No,,No,,No,,No,,N/A,,,,,,,,,,,,,,,,,,,,,,,,,,,,,,,,,,,,,,,,,,,,,,,,,,,,,,,,,,,,,,,,,,,,,,,,,,,,,,,,,,,,,,,,,,,,,,,,,,,,,,,,,,,,,,,,,
1/16/24 8:51:32,"33Across, Inc.",,https://www.33across.com,privacy@33across.com,,"228 Park Avenue South, PMB 74008",New York,NY,10003,USA,,No,No,No,https://www.33across.com/privacy-policy/ccpa-notice/,No,,No,,No,,No,,No,,N/A,,,,,,,,,,,,,,,,,,,,,,,,,,,,,,,,,,,,,,,,,,,,,,,,,,,,,,,,,,,,,,,,,,,,,,,,,,,,,,,,,,,,,,,,,,,,,,,,,,,,,,,,,,,,,,,,,
1/16/24 9:24:34,Claritas LLC.,,https://www.claritas.com,al.gadbut@claritas.com,,"8044 Montgomery Road, Suite 455
",Cincinnati,OH,45236,USA,"Privacy Officer
Claritas, LLC
8044 Montgomery Road, Suite 455
Cincinnati, OH 45236 USA",No,No,No,https://privacyportal.onetrust.com/webform/68582716-6ce4-4f6e-bf08-78371b5f3292/6c7dc52d-0e2b-481f-9256-0755179e3783.html,No,,No,,No,,No,,No,,claritas.com/privacy-legal/,,,,,,,,,,,,,,,,,,,,,,,,,,,,,,,,,,,,,,,,,,,,,,,,,,,,,,,,,,,,,,,,,,,,,,,,,,,,,,,,,,,,,,,,,,,,,,,,,,,,,,,,,,,,,,,,,
1/16/24 10:48:58,"e.Republic, LLC",,https://www.erepublic.com,privacy@erepublic.com,916-932-1300,100 Blue Ravine Road Suite 100,Folsom,CA,95630,USA,,No,No,No,https://erepublic.my.salesforce-sites.com/PrivacyRequest/,No,,No,,No,,No,,No,,"Data is collected when consumers share their information at the time of registering with us through our websites, through telephone calls, and through the review of publicly listed information on government websites.",,,,,,,,,,,,,,,,,,,,,,,,,,,,,,,,,,,,,,,,,,,,,,,,,,,,,,,,,,,,,,,,,,,,,,,,,,,,,,,,,,,,,,,,,,,,,,,,,,,,,,,,,,,,,,,,,
1/16/24 10:50:31,"Buildertrend Solutions, Inc.",,https://www.buildertrend.com,privacy@buildertrend.com,,11818 I Street,Omaha,NE,68137,USA,,No,Yes,No,https://buildertrend.com/privacy-policy/,Yes,The business runs background checks and credit checks (as applicable) on applicants.,No,,No,,No,,Yes,Certain activities of the business' self insured health plan may be regulated by HIPAA.,More information can be found here: buildertrend.com/privacy-policy/,,,,,,,,,,,,,,,,,,,,,,,,,,,,,,,,,,,,,,,,,,,,,,,,,,,,,,,,,,,,,,,,,,,,,,,,,,,,,,,,,,,,,,,,,,,,,,,,,,,,,,,,,,,,,,,,,
1/16/24 11:15:11,"InfoPay, Inc",,https://www.infopay.com,compliance@infopay.com,,"227 Lewis Wharf
",Boston,MA,02110,USA,,No,No,No,https://www.infopay.com/privacy ,Yes,The Data that we provide is regulated by FCRA.,Yes,InfoTracer Business is regulated by GLBA.,No,,No,,No,,Kindly refer to our privacy policy for the most recent information on our data collection practices: www.infopay.com/privacy.,,,,,,,,,,,,,,,,,,,,,,,,,,,,,,,,,,,,,,,,,,,,,,,,,,,,,,,,,,,,,,,,,,,,,,,,,,,,,,,,,,,,,,,,,,,,,,,,,,,,,,,,,,,,,,,,,
1/16/24 12:34:48,Equimine,PropStream,https://www.propstream.com,privacyinquiry@propstream.com,(877) 204-9040,26457 Rancho Parkway South,Lake Forest,CA,92630,USA,,No,No,No,https://www.propstream.com/privacy-request-form,No,,No,,No,,No,,No,,N/A,,,,,,,,,,,,,,,,,,,,,,,,,,,,,,,,,,,,,,,,,,,,,,,,,,,,,,,,,,,,,,,,,,,,,,,,,,,,,,,,,,,,,,,,,,,,,,,,,,,,,,,,,,,,,,,,,
1/16/24 14:31:29,Market Force Corporation,MarketForce,https://www.marketforcecorp.com,maejames@marketforcecorp.com,402-921-0178,5248 Abelia Drive,Orlando,FL,32819,USA,,No,No,No,https://marketforcecorp.com/privacy-policy/,No,,No,,No,,Yes,,No,,"Market Force Corporation receives and uses data from internal and external self-reported sources.  These include public county and government sources and data suppliers.  MFC does not utilize unauthorized 3rd party data sources.  MarketForce collects new business data including business contact information such as name, title, address, phone number, fax number, email address, domain names and trade associations for the purpose of data marketing, marketing services and analysis.  This data allows MarketForce to deliver products and services that assist our customers in making critical commercial decisions.",,,,,,,,,,,,,,,,,,,,,,,,,,,,,,,,,,,,,,,,,,,,,,,,,,,,,,,,,,,,,,,,,,,,,,,,,,,,,,,,,,,,,,,,,,,,,,,,,,,,,,,,,,,,,,,,,
1/16/24 14:34:43,"Intalytics, Inc.",Kalibrate,https://www.intalytics.com,privacy@kalibrate.com,,"38695 Seven Mile Rd, Suite 105",Livonia,MI,48152,USA,,No,No,No,https://kalibrate.com/data-subject-access-request-form/,No,,No,,No,,No,,Yes,Only as applicable to a business associate of covered entity clients.,No,,,,,,,,,,,,,,,,,,,,,,,,,,,,,,,,,,,,,,,,,,,,,,,,,,,,,,,,,,,,,,,,,,,,,,,,,,,,,,,,,,,,,,,,,,,,,,,,,,,,,,,,,,,,,,,,,
