1/31/24 9:26:24,"5x5 US, LLC ",5x5,https://www.5x5coop.com,privacy@5x5coop.com ,512-827-9312,P.O. Box 2354,Austin ,TX,78768,USA,,No,Yes,No,https://5x5coop.com/do-not-sell-my-info/ ,No,,No,,No,,No,,No,,"We collect Personal Information from individuals when they visit our Site, when they contact us, or submit a request through the Site, from third parties, or when they submit such PI. We may use automatic data collection technologies to collect certain information about user's equipment, browsing actions, and patterns. We may also collect anonymous, de-identified, and aggregate information about the type of browser the individual is using, the type of operating system they use, the date and time of any request, language preference, referring site, and the domain name of the individual's Internet service provider. After receiving the PI, we store it on our server.

5x5 may collect or store PI by using cookies. Cookies, by themselves, do not tell us user's email address or other PI. We also collect information through “clickstream data”. We may use clickstream data as a form of Aggregate/De-Identified Information to determine how much time visitors spend on each page of our Site, how visitors navigate through the Site, and how we may tailor our web pages to better meet the needs of our Visitors.

An individual may go directly to: 5x5coop.com/do-not-sell-my-info/ to opt out and to make do not sell requests or privacy@5x5coop.com for any opt-out requests. If consumers are filling out the form, they are required to enter a current email address and full name, and select their opt-out preferences. 

Please visit our privacy policy at 5x5coop.com/privacy-policy/ for additional information about data collection practices.",,,,,,,,,,,,,,,,,,,,,,,,,,,,,,,,,,,,,,,,,,,,,,,,,,,,,,,,,,,,,,,,,,,,,,,,,,,,,,,,,,,,,,,,,,,,,,,,,,,,,,,,,,,,,,,,,
1/31/24 9:41:18,LexisNexis Risk Solutions,,https://www.risk.lexisnexis.com,consumer.documents@lexisnexisrisk.com,1-888-217-1591,1000 Alderman Drive,Alpharetta,GA,30005,USA,,Yes,Yes,Yes,https://consumer.risk.lexisnexis.com/california,Yes,The subsidiaries that are regulated by FCRA are those that provide consumer reports for purposes such as insurance and credit underwriting as permitted by FCRA.,Yes,The subsidiaries that are regulated by GLBA are those that provide services for purposes such as fraud prevention and risk management as permitted by GLBA.,Yes,"The subsidiaries that are regulated by IIPPA are those that provide services as an insurance support organization, including to support insurance transactions and the detection and prevention of fraud.  ",Yes,The business and its subsidiaries are not health care providers but may handle medical information protected under CMIA in their role as service providers for life insurance carriers or healthcare organizations subject to consumer consent.,Yes,The subsidiaries that are regulated by HIPAA are business associates under HIPAA. ,"The business actively works to exclude from its products and does not specifically seek personal information relating to consumers with a date of birth indicating that the consumer is a minor, except in connection with services where it provides personal information to insurance carriers regarding licensed drivers who are minors, including those who may need to be added to household automobile insurance policies.
 
The business collects motor vehicle telematics information that may contain historic driving behavior and vehicle location information. The business offers insurance companies motor vehicle telematics services that, with consumer consent, are used for motor vehicle insurance pricing. The business does not sell real-time precise geolocation information.

The business collects health information as a service provider to life insurance carriers and subject to consumers’ consent.

The business implements a robust credentialing process that requires that purchasers are legitimate business, government, non-profit, or educational institutions. 
",,,,,,,,,,,,,,,,,,,,,,,,,,,,,,,,,,,,,,,,,,,,,,,,,,,,,,,,,,,,,,,,,,,,,,,,,,,,,,,,,,,,,,,,,,,,,,,,,,,,,,,,,,,,,,,,,
1/31/24 9:45:51,"APIHub, Inc.",Clearbit,https://www.clearbit.com/,privacy@clearbit.com,,548 Market St #95879,San Francisco,CA,94104-5401,USA,,No,No,No,https://clearbit.com/ccpa,No,,No,,No,,No,,No,,N/A,,,,,,,,,,,,,,,,,,,,,,,,,,,,,,,,,,,,,,,,,,,,,,,,,,,,,,,,,,,,,,,,,,,,,,,,,,,,,,,,,,,,,,,,,,,,,,,,,,,,,,,,,,,,,,,,,
1/31/24 10:12:29,"Altair Data Resources, Inc.",,https://www.altairdata.com,jsmith@altairci.com,615-468-6885,"1749 Mallory Lane, Ste. 201",Brentwood,TN,37027,USA,,No,No,No,https://www.altairdata.com/altair-privacy-policy/,Yes,"As an Agent and Reseller of regulated consumer data, Altair is obligated to comply with all applicable federal regulations, including the FCRA and GLBA.",Yes,"As an Agent and Reseller of regulated consumer data, Altair is obligated to comply with all applicable federal regulations, including the FCRA and GLBA.",No,,No,,No,,"Altair does not collect any data from consumers. The datasets that we procure and provide our clients are derived from other sources, including all three major credit bureaus. We have contracts in place with the data vendors to use and resell its data. Altair's clients or data vendors would receive any opt-out requests and control the process. However, Altair provides a direct opt-out process for consumers.

Re: Q14: Altair does not collect, but if our client provides, the information is strictly for that client's use, and it is not brokered, sold, or shared.
",,,,,,,,,,,,,,,,,,,,,,,,,,,,,,,,,,,,,,,,,,,,,,,,,,,,,,,,,,,,,,,,,,,,,,,,,,,,,,,,,,,,,,,,,,,,,,,,,,,,,,,,,,,,,,,,,
1/31/24 10:13:26,"ZS Associates, Inc.",,https://www.zs.com,dataprivacy@zs.com,,"One Rotary Center, 1560 Sherman Ave.",Evanston,IL,60201,USA,,No,No,Yes,https://www.zs.com/data-request,No,,No,,No,,No,,Yes,"ZS operates a self-funded insurance plan, and therefore is a Covered Entity in this regard. In certain client engagements, ZS may be a Business Associate.","ZS primarily handles publicly available professional information about individuals working within healthcare (i.e., HCPs). 

The consumer healthcare data that ZS handles is outside of our role as a data broker.",,,,,,,,,,,,,,,,,,,,,,,,,,,,,,,,,,,,,,,,,,,,,,,,,,,,,,,,,,,,,,,,,,,,,,,,,,,,,,,,,,,,,,,,,,,,,,,,,,,,,,,,,,,,,,,,,
1/31/24 10:16:15,Viant US LLC,Adelphic LLC,https://www.viantinc.com,CGomeztrejo@viantinc.com,9498618888,2722 Michelson Dr. Suite 100,Irvine,CA,92612,USA,,Yes,Yes,No,https://www.viantinc.com/privacy-center/,No,,No,,No,,No,,No,,N/A,,,,,,,,,,,,,,,,,,,,,,,,,,,,,,,,,,,,,,,,,,,,,,,,,,,,,,,,,,,,,,,,,,,,,,,,,,,,,,,,,,,,,,,,,,,,,,,,,,,,,,,,,,,,,,,,,
1/31/24 10:41:48,Redbird Direct LLC,,https://www.redbirddirect.com,privacy@redbirddirect.com,,2321 SW 98TH TER,DAVIE,FL,33324,USA,,No,No,No,"Redbird Direct does not collect or store any consumer data. www.epsilon.com/request,dmachoice.thedma.org/, privacy.aslmarketing.com,www.experian.com/privacy/#consumerprivacy, fanfinders.com/privacy-policy, www.pnmag.com/privacy-policy/, www.heymilestone.com/pages/privacy-policy, www.motherhood.com/pages/privacy-policy www.motherhood.com/pages/terms-and-conditions   www.apeainthepod.com/pages/privacy-policy www.apeainthepod.com/pages/terms-and-conditions   www.hatchcollection.com/pages/privacy-policy www.hatchcollection.com/pages/terms-of-use, www.myregistry.com/Info/Privacy.aspx,  privacy@aslmarketing.com, www.data-axle.com/privacy-policy/,  www.epsilon.com/request, www.babylist.com/privacy, glowing.com/privacy-policy, www.hatchcollection.com/pages/privacy-statement, deepsync.com/privacy-policy/, www.iqvia.com/about-us/privacy/privacy-policy, www.iqvia.com/-/media/iqvia/pdfs/data-protection-notice/onekeyuken.pdf",No,,Yes,legal.epsilon.com/us/general-publisher-agreement,No,,No,,No,,"Redbird Direct LLC does not collect, transfer directly or store any consumer data. We are a business to business organization.",,,,,,,,,,,,,,,,,,,,,,,,,,,,,,,,,,,,,,,,,,,,,,,,,,,,,,,,,,,,,,,,,,,,,,,,,,,,,,,,,,,,,,,,,,,,,,,,,,,,,,,,,,,,,,,,,
1/31/24 10:57:18,Mediazod LLC,Leadzod,https://www.leadzod.com,Privacy@leadzod.com,,3418 Stocktie Road,Charlotte,NC,28210,USA,,No,No,No,"Email or call the advertiser or website that you were contacted by to opt out per any terms and conditions you may have agreed to with that advertiser. Disclaimer: Leadzod.com does not own or operate any of its own websites that consumers visit and opt in to request to be contacted with TCPA or email disclosure present at time of opting in. Leadzod.com contracts to hire publishers who own and operate their own web properties, or connect to partner web properties which advertisements are present for consumers to freely choose to opt in or not to be contacted. Leadzod.com standard practices is that we do not touch leads or data unless there is a compliance/legal/troubleshooting issue. Realtime Opt in Leads are sent via api directly from the publisher to the advertiser in order to prevent Leadzod.com from holding leads on a day to day basis.",No,,No,,No,,No,,No,,"Disclaimer: Leadzod.com does not own or operate any of its own websites that consumers visit and opt in to request to be contacted with TCPA or email disclosure present at time of opting in. Leadzod.com contracts to hire publishers who own and operate their own web properties, or connect to partner web properties which advertisements are present for consumers to freely choose to opt in or not to be contacted. Leadzod.com standard practices is that we do not touch leads or data unless there is a compliance/legal/troubleshooting issue. Realtime Opt in Leads are sent via api directly from the publisher to the advertiser in order to prevent Leadzod.com from holding leads on a day to day basis.",,,,,,,,,,,,,,,,,,,,,,,,,,,,,,,,,,,,,,,,,,,,,,,,,,,,,,,,,,,,,,,,,,,,,,,,,,,,,,,,,,,,,,,,,,,,,,,,,,,,,,,,,,,,,,,,,
1/31/24 11:38:34,"Glad I Know, Inc.",Glad I Know,https://www.gladiknow.com,jeff@gladiknow.com,(800) 622-0474,121 17th Street,Manhattan Beach ,CA,90266,USA,,No,No,No,https://gladiknow.com/opt-out,No,,No,,No,,No,,No,,We collect no data.,,,,,,,,,,,,,,,,,,,,,,,,,,,,,,,,,,,,,,,,,,,,,,,,,,,,,,,,,,,,,,,,,,,,,,,,,,,,,,,,,,,,,,,,,,,,,,,,,,,,,,,,,,,,,,,,,
1/31/24 12:18:01,"Hero Group, Inc.",STEP2SUCCESS Marketing,http://s2smarketing.com,marys@step2successmarketing.com,,12561 Ulmerton Road,Largo,FL,33774,USA,,No,No,No,https://mydataprivacy.com/,No,,No,,No,,No,,No,,N/A,,,,,,,,,,,,,,,,,,,,,,,,,,,,,,,,,,,,,,,,,,,,,,,,,,,,,,,,,,,,,,,,,,,,,,,,,,,,,,,,,,,,,,,,,,,,,,,,,,,,,,,,,,,,,,,,,
1/31/24 12:58:47,"Unearth Campaigns, LLC",,https://www.unearthcampaigns.com,privacy@unearthcampaigns.com,,"555 Capitol Mall, Suite 640",Sacramento,CA,95814,USA,,No,No,No,https://www.unearthcampaigns.com/privacy-policy/,No,,No,,No,,No,,No,,Unearth processes information about California consumers in accordance with Unearth’s Privacy Policy (www.unearthcampaigns.com/privacy-policy/) and its California Privacy Notice (www.unearthcampaigns.com/privacy-policy/#ca).,,,,,,,,,,,,,,,,,,,,,,,,,,,,,,,,,,,,,,,,,,,,,,,,,,,,,,,,,,,,,,,,,,,,,,,,,,,,,,,,,,,,,,,,,,,,,,,,,,,,,,,,,,,,,,,,,
1/31/24 13:04:40,"TruSignal, Inc.",,https://www.transunion.com,privacy@transunion.com,,555 W Adams St,Chicago,IL,60661,USA,,No,No,No,https://www.transunion.com/privacy/transunion ,No,,No,,No,,No,,No,,www.transunion.com/privacy/transunion ,,,,,,,,,,,,,,,,,,,,,,,,,,,,,,,,,,,,,,,,,,,,,,,,,,,,,,,,,,,,,,,,,,,,,,,,,,,,,,,,,,,,,,,,,,,,,,,,,,,,,,,,,,,,,,,,,
1/31/24 13:16:12,Tru Optik Data Corp.,,https://www.transunion.com,privacy@transunion.com,,555 W Adams St,Chicago,IL,60661,USA,,No,No,No,https://www.transunion.com/privacy/transunion ,No,,No,,No,,No,,No,,"For additional information about how TransUnion Companies process personal information, please visit: www.transunion.com/privacy/transunion",,,,,,,,,,,,,,,,,,,,,,,,,,,,,,,,,,,,,,,,,,,,,,,,,,,,,,,,,,,,,,,,,,,,,,,,,,,,,,,,,,,,,,,,,,,,,,,,,,,,,,,,,,,,,,,,,
1/31/24 13:20:04,"i360, LLC",,https://www.i-360.com,privacy@i-360.com,,PO Box 663,Arlington,VA,22216,USA,,No,No,No,https://www.i-360.com/privacy-policy,No,,No,,No,,No,,No,,Additional information about data collecting practices can be found at www.i-360.com/ccpa and www.i-360.com/privacy-policy.,,,,,,,,,,,,,,,,,,,,,,,,,,,,,,,,,,,,,,,,,,,,,,,,,,,,,,,,,,,,,,,,,,,,,,,,,,,,,,,,,,,,,,,,,,,,,,,,,,,,,,,,,,,,,,,,,
1/31/24 13:20:04,Preferred Communications Data LLC,Preferred Communications,https://www.preferredcommunications.com,info@preferredcommunications.com,,"P.O. Box 340901
",Austin,TX,78734,USA,,No,No,No,https://preferredcommunications.com/consumer-opt-out/,No,,No,,No,,No,,No,,N/A,,,,,,,,,,,,,,,,,,,,,,,,,,,,,,,,,,,,,,,,,,,,,,,,,,,,,,,,,,,,,,,,,,,,,,,,,,,,,,,,,,,,,,,,,,,,,,,,,,,,,,,,,,,,,,,,,
1/31/24 13:24:04,"TransUnion Risk and Alternative Data Solutions, Inc.",,https://www.transunion.com,privacy@transunion.com,,555 W Adams St,Chicago,IL,60661,USA,,No,No,No,https://www.transunion.com/privacy/risk-alternative-data-solutions ,No,,Yes,"TransUnion Companies, including TransUnion Risk and Alternative Data Solutions, offer certain products and internally use GLBA-regulated data for GLBA permitted purposes",No,,No,,Yes,TransUnion Risk and Alternative Data Solutions acts as a Business Associate under HIPAA at the direction of customers acting as Covered Entities.  ,"For additional information about how TransUnion Companies process personal information, please visit: www.transunion.com/privacy/transunion",,,,,,,,,,,,,,,,,,,,,,,,,,,,,,,,,,,,,,,,,,,,,,,,,,,,,,,,,,,,,,,,,,,,,,,,,,,,,,,,,,,,,,,,,,,,,,,,,,,,,,,,,,,,,,,,,
1/31/24 13:27:53,"Monevo, Inc.",,https://www.monevo.com,usasupport@monevo.com,,"169 Saxony Rd., Suite 212",Encinitas,CA,92024,USA,,No,No,No,https://app.monevo.us/california-privacy-policy,Yes,"Monevo is a ""reseller"" and acts in the capacity of a Consumer Reporting Agency in which it requests Soft Credit Pull requests from CRAs for eligibility purposes.",Yes,"Requirements for protecting confidentiality, security and integrity of nonpersonal public information it may collect.",No,,No,,No,,Monevo maintains secure files and privacy practices.  Monevo is SOC-2 Type II certified.,,,,,,,,,,,,,,,,,,,,,,,,,,,,,,,,,,,,,,,,,,,,,,,,,,,,,,,,,,,,,,,,,,,,,,,,,,,,,,,,,,,,,,,,,,,,,,,,,,,,,,,,,,,,,,,,,
1/31/24 13:29:37,"Terminus Software, Inc.",,https://www.terminus.com,privacy@terminus.com,888.3739406,"925B Peachtree St NE, #313",Atlanta,GA,30309,USA,,No,No,No,https://terminus.com/ccpa/,No,,No,,No,,No,,No,,Terminus' Privacy Policy is located here: terminus.com/privacy-policy/,,,,,,,,,,,,,,,,,,,,,,,,,,,,,,,,,,,,,,,,,,,,,,,,,,,,,,,,,,,,,,,,,,,,,,,,,,,,,,,,,,,,,,,,,,,,,,,,,,,,,,,,,,,,,,,,,
1/31/24 13:53:44,TransUnion Digital LLC,,https://www.transunion.com,privacy@transunion.com,,555 W Adams St,Chicago,IL,60661,USA,,No,No,No,https://www.transunion.com/privacy/transunion,No,,No,,No,,No,,No,,"For additional information about how TransUnion Companies process personal information, please visit: www.transunion.com/privacy/transunion",,,,,,,,,,,,,,,,,,,,,,,,,,,,,,,,,,,,,,,,,,,,,,,,,,,,,,,,,,,,,,,,,,,,,,,,,,,,,,,,,,,,,,,,,,,,,,,,,,,,,,,,,,,,,,,,,
1/31/24 14:18:12,Trans Union LLC,,https://www.transunion.com,privacy@transunion.com,,555 W Adams St,Chicago,IL,60661,USA,,Yes,No,No,https://www.transunion.com/privacy/transunion,Yes,"TransUnion may use information to update our consumer credit database. Access to Personally Identifiable Consumer Information on this database is limited to: (1) entities with a permissible purpose to receive it, as defined in the Fair Credit Reporting Act (“FCRA”); (2) entities with a permitted use under Title V of the Gramm-Leach-Bliley Act; (3) companies who resell our data as permitted under law; and (4) companies who process data on our behalf.",Yes,TransUnion Companies offer certain products and internally use GLBA-regulated data for GLBA permitted purposes.,No,,No,,Yes,TransUnion acts as a Business Associate under HIPAA at the direction of customers acting as Covered Entities.  ,"For additional information about how TransUnion Companies process personal information, please visit: www.transunion.com/privacy/transunion",,,,,,,,,,,,,,,,,,,,,,,,,,,,,,,,,,,,,,,,,,,,,,,,,,,,,,,,,,,,,,,,,,,,,,,,,,,,,,,,,,,,,,,,,,,,,,,,,,,,,,,,,,,,,,,,,
1/31/24 14:20:44,"Andrews Wharton, Inc. ",,https://www.andrewswharton.com,privacy@andrewswharton.com,631-470-4546,"700 Veterans Memorial Highway, Suite 115",Hauppauge,NY,11788,USA,,No,No,No,https://www.andrewswharton.com/privacy,No,,No,,No,,No,,No,,Not at this time.,,,,,,,,,,,,,,,,,,,,,,,,,,,,,,,,,,,,,,,,,,,,,,,,,,,,,,,,,,,,,,,,,,,,,,,,,,,,,,,,,,,,,,,,,,,,,,,,,,,,,,,,,,,,,,,,,
1/31/24 14:22:55,DealerDirect LLC,FordDirect,https://www.forddirect.com,dprivacy@forddirect.com,," 4 Parklane Blvd, Suite 140",Dearborn,MI,48126,USA,,No,No,No,https://www.forddirectprivacy.com,Yes,FordDirect is governed by FCRA only in the context of pre-employment background checks for its own potential employees. ,No,,Yes,FordDirect is regulated by IIPPA only in the context of providing insurance benefits to its California employees. ,No,,No,,N/A,,,,,,,,,,,,,,,,,,,,,,,,,,,,,,,,,,,,,,,,,,,,,,,,,,,,,,,,,,,,,,,,,,,,,,,,,,,,,,,,,,,,,,,,,,,,,,,,,,,,,,,,,,,,,,,,,
1/31/24 14:27:24,"TransUnion Interactive, Inc. ",,https://www.transunion.com,privacy@transunion.com,,555 W Adams St,Chicago,IL,60661,USA,,Yes,No,No,https://www.transunion.com/privacy/consumer-interactive,No,,Yes,"TransUnion Companies, including TransUnion Interactive, offer certain products and internally use GLBA-regulated data for GLBA permitted purposes.",No,,No,,No,,"For additional information about how TransUnion Companies process personal information, please visit: www.transunion.com/privacy/transunion.",,,,,,,,,,,,,,,,,,,,,,,,,,,,,,,,,,,,,,,,,,,,,,,,,,,,,,,,,,,,,,,,,,,,,,,,,,,,,,,,,,,,,,,,,,,,,,,,,,,,,,,,,,,,,,,,,
1/31/24 14:33:28,Trans Union Content Solutions LLC,,https://www.transunion.com,privacy@transunion.com,,555 W Adams St,Chicago,IL,60661,USA,,No,No,No,https://www.transunion.com/privacy/transunion,No,,No,,No,,No,,No,,"For additional information about how TransUnion Companies process personal information, please visit: www.transunion.com/privacy/transunion",,,,,,,,,,,,,,,,,,,,,,,,,,,,,,,,,,,,,,,,,,,,,,,,,,,,,,,,,,,,,,,,,,,,,,,,,,,,,,,,,,,,,,,,,,,,,,,,,,,,,,,,,,,,,,,,,
1/31/24 14:49:27,"PureCars Technologies, LLC","The AutoMiner, TruPayments, PureCars",https://www.purecars.com,privacy@purecars.com ,,"931 Monroe Drive NE Suite A102 #359
",Atlanta,GA,30308,USA,,No,No,No,https://www.purecars.com/privacy-policy,No,,Yes,"PureCars receives some NPI from its software-as-a-service (“the AutoMiner” or “TAM”) and marketing services (“DigAd”) business-to-business customers, which are auto dealerships that are regulated by the GLBA. ",No,,No,,No,,"We are happy to answer any questions that you may have, but we do not have additional information to provide at this time regarding our data collection practices. 
",,,,,,,,,,,,,,,,,,,,,,,,,,,,,,,,,,,,,,,,,,,,,,,,,,,,,,,,,,,,,,,,,,,,,,,,,,,,,,,,,,,,,,,,,,,,,,,,,,,,,,,,,,,,,,,,,
1/31/24 18:17:09,"SpyCloud, Inc.",,https://www.spycloud.com,legal@spycloud.com,,2130 S. Congress Ave.,Austin,TX,78723,USA,,No,No,No,https://spycloud.com/legal-and-privacy-center/privacy-policy/,No,,No,,No,,No,,No,,None,,,,,,,,,,,,,,,,,,,,,,,,,,,,,,,,,,,,,,,,,,,,,,,,,,,,,,,,,,,,,,,,,,,,,,,,,,,,,,,,,,,,,,,,,,,,,,,,,,,,,,,,,,,,,,,,,
2/1/24 4:14:13,Adttribution Inc,,https://www.adttribution.com,mike@adttribution.com,,16192 Coastal Highway,Lewes,DE, 19958,USA,,No,Yes,No,https://adttribution.com/opt-out.html,No,,No,,No,,No,,No,,N/A,,,,,,,,,,,,,,,,,,,,,,,,,,,,,,,,,,,,,,,,,,,,,,,,,,,,,,,,,,,,,,,,,,,,,,,,,,,,,,,,,,,,,,,,,,,,,,,,,,,,,,,,,,,,,,,,,
2/1/24 4:42:02,Fifty Technology Ltd,,https://www.fifty.io,hello@fifty.io,,,,,,,"24 Hanover Square
London
W1S 1JD",No,No,No,https://fifty.io/privacy-policy,No,,No,,No,,No,,No,,We work with data aggregators and collect personal information (cookie data and other online identifiers tied to PI),,,,,,,,,,,,,,,,,,,,,,,,,,,,,,,,,,,,,,,,,,,,,,,,,,,,,,,,,,,,,,,,,,,,,,,,,,,,,,,,,,,,,,,,,,,,,,,,,,,,,,,,,,,,,,,,,
2/1/24 9:51:47,"Traackr, Inc",,https://www.traackr.com,Legal@traackr.com,,"25 Dorchester Ave, #52497",Boston,MA,02205,USA,,No,No,No,https://www.traackr.com/privacy-policy,No,,No,,No,,No,,No,,N/A,,,,,,,,,,,,,,,,,,,,,,,,,,,,,,,,,,,,,,,,,,,,,,,,,,,,,,,,,,,,,,,,,,,,,,,,,,,,,,,,,,,,,,,,,,,,,,,,,,,,,,,,,,,,,,,,,
2/4/24 3:47:29,Social Catfish LLC,,https://www.socialcatfish.com,welcome@socialcatfish.com,8444228347,38770 Sky Canyon Dr. STE A,Murrieta,CA,92563,USA,,No,No,No,https://socialcatfish.com/opt-out/?id=request_optout,No,,No,,No,,No,,No,,"Additional information about your rights and how you may exercise them under the CPPA, including requests to opt-out of the sale of your information, may be found here: socialcatfish.com/faq/privacy/",,,,,,,,,,,,,,,,,,,,,,,,,,,,,,,,,,,,,,,,,,,,,,,,,,,,,,,,,,,,,,,,,,,,,,,,,,,,,,,,,,,,,,,,,,,,,,,,,,,,,,,,,,,,,,,,,
2/6/24 9:33:19,"Dresden Direct, Inc.",,http://www.dresdendirect.com,info@dresdendirect.com,,109 Saint Edward Pl,Palm Beach Gardens,FL,33418,USA,,No,No,No,http://Dresdendirect.com,No,,Yes,data broker,No,,No,,No,,Primarily a consultant,,,,,,,,,,,,,,,,,,,,,,,,,,,,,,,,,,,,,,,,,,,,,,,,,,,,,,,,,,,,,,,,,,,,,,,,,,,,,,,,,,,,,,,,,,,,,,,,,,,,,,,,,,,,,,,,,
2/6/24 13:01:59,"WealthEngine, Inc.",,https://www.wealthengine.com,privacy@altrata.com,,1270 Avenue of the Americas,New York,NY,10020,USA,,No,No,No,https://altrata.com/product-privacy-notice,No,,No,,No,,No,,Yes,"As a Business Associate and only in the event that one of our client’s is covered by HIPAA as a Covered Entity and supplied us with a Business Associate Agreement the parties would then agree to the privacy, security and breach notification provided within that Business Associate Agreement. ",As provided within our Privacy Notice.,,,,,,,,,,,,,,,,,,,,,,,,,,,,,,,,,,,,,,,,,,,,,,,,,,,,,,,,,,,,,,,,,,,,,,,,,,,,,,,,,,,,,,,,,,,,,,,,,,,,,,,,,,,,,,,,,
2/6/24 13:11:22,"Wealth-X, LLC",,https://www.wealthx.com,privacy@altrata.com,,"1270 Avenue of the Americas, Suite 1100",New York,NY,80129,USA,,No,No,No,https://altrata.com/product-privacy-notice,No,,No,,No,,No,,Yes,"As a Business Associate and only in the event that one of our client’s is covered by HIPAA as a Covered Entity and supplied us with a Business Associate Agreement the parties would then agree to the privacy, security and breach notification provided within that Business Associate Agreement. ",As provided within our Privacy Notice. ,,,,,,,,,,,,,,,,,,,,,,,,,,,,,,,,,,,,,,,,,,,,,,,,,,,,,,,,,,,,,,,,,,,,,,,,,,,,,,,,,,,,,,,,,,,,,,,,,,,,,,,,,,,,,,,,,
2/6/24 13:17:37,"BoardEx, LLC",Relationship Science,https://www.relsci.com,privacy@altrata.com,,"1270 Avenue of the Americas, Suite 1100",New York,NY,10020,USA,,No,No,No,https://altrata.com/product-privacy-notice,No,,No,,No,,No,,Yes,"As a Business Associate and only in the event that one of our client’s is covered by HIPAA as a Covered Entity and supplied us with a Business Associate Agreement the parties would then agree to the privacy, security and breach notification provided within that Business Associate Agreement. ",As provided within our Privacy Notice. ,,,,,,,,,,,,,,,,,,,,,,,,,,,,,,,,,,,,,,,,,,,,,,,,,,,,,,,,,,,,,,,,,,,,,,,,,,,,,,,,,,,,,,,,,,,,,,,,,,,,,,,,,,,,,,,,,
2/6/24 13:21:59,"BoardEx, LLC",,https://www.boardex.com,privacy@altrata.com,,"1270 Avenue of the Americas, Suite 1100",New York,NY,10020,USA,,No,No,No,https://altrata.com/product-privacy-notice,No,,No,,No,,No,,Yes,"As a Business Associate and only in the event that one of our client’s is covered by HIPAA as a Covered Entity and supplied us with a Business Associate Agreement the parties would then agree to the privacy, security and breach notification provided within that Business Associate Agreement. ",As provided within our Privacy Notice. ,,,,,,,,,,,,,,,,,,,,,,,,,,,,,,,,,,,,,,,,,,,,,,,,,,,,,,,,,,,,,,,,,,,,,,,,,,,,,,,,,,,,,,,,,,,,,,,,,,,,,,,,,,,,,,,,,
2/6/24 13:26:41,"Boardroom Insiders, Inc.",,https://www.boardroominsiders.com,privacy@altrata.com,,"1270 Avenue of the Americas, Suite 1100",New York,NY,10020,USA,,No,No,No,https://altrata.com/product-privacy-notice,No,,No,,No,,No,,Yes,"As a Business Associate and only in the event that one of our client’s is covered by HIPAA as a Covered Entity and supplied us with a Business Associate Agreement the parties would then agree to the privacy, security and breach notification provided within that Business Associate Agreement. ",As provided within our Privacy Notice. ,,,,,,,,,,,,,,,,,,,,,,,,,,,,,,,,,,,,,,,,,,,,,,,,,,,,,,,,,,,,,,,,,,,,,,,,,,,,,,,,,,,,,,,,,,,,,,,,,,,,,,,,,,,,,,,,,
2/6/24 15:44:36,SciLeads Ltd,Yes,https://scileads.com,privacy@scileads.com,,"Arnott House, 12-16 Bridge Street",Belfast,N/A,BT1 1LU,United Kingdom,,No,No,No,https://scileads.com/privacy-policy,No,,No,,No,,No,,No,,SciLeads aggregates publicly available information about scientists from open access government websites as well as online science sites.,,,,,,,,,,,,,,,,,,,,,,,,,,,,,,,,,,,,,,,,,,,,,,,,,,,,,,,,,,,,,,,,,,,,,,,,,,,,,,,,,,,,,,,,,,,,,,,,,,,,,,,,,,,,,,,,,
2/6/24 16:29:11,"InMarket Media, LLC",,https://www.inmarket.com,jknapp@inmarket.com,,"111 Congress Ave, Suite 500",Austin,TX,78701,USA,,No,Yes,No,https://inmarket.com/privacy,No,,No,,No,,No,,No,,None,,,,,,,,,,,,,,,,,,,,,,,,,,,,,,,,,,,,,,,,,,,,,,,,,,,,,,,,,,,,,,,,,,,,,,,,,,,,,,,,,,,,,,,,,,,,,,,,,,,,,,,,,,,,,,,,,
2/6/24 16:56:34,Gale,,https://www.gale.com,privacy@cengage.com,,5191 Natorp Blvd.,Mason,OH,45040,USA,,Yes,No,No,https://cengage.widen.net/view/pdf/hk69f4p7oq/cengage-privacy-notice-october-2020-1508150.pdf?t.download=true&u=lpaabn,No,,Yes,The business is subject to GLBA in connection with offering financing for ed2go courses.,No,,No,,No,,N/A,,,,,,,,,,,,,,,,,,,,,,,,,,,,,,,,,,,,,,,,,,,,,,,,,,,,,,,,,,,,,,,,,,,,,,,,,,,,,,,,,,,,,,,,,,,,,,,,,,,,,,,,,,,,,,,,,
